song_id,song_title,artist_id,artist_name,song_year_combined,song_decade_combined,lyrics,Annotators,is_care,is_harm,is_fairness,is_cheating,is_loyalty,is_betrayal,is_authority,is_subversion,is_purity,is_degradation
5714ded125ac0d8aee4337b1,This Corrosion,56d8374853a7ddfc01f95ab6,Godhead,2008,2000,"Gimme the Ring, kissed and toll'd
Gimme something that I missed
(Gimme the ring)
A hand to hold, wild and what it seems
(Gimme the ring)
Kill the king, when love is the law,
And the we'll turn round...
(Gimme the ring)
Gimme dream child
And do you hear me call?
(Gimme the ring)
On the loan and on the level
...still on the floor
(Gimme the ring)
Sing dream child
And do you hear at all?

(Sing)
(Sing)
Hey now, hey now now, sing This Corrosion to me
Hey now, hey now now, sing This Corrosion to me
Hey now, hey now now, sing This Corrosion to me
Hey now, hey now now, sing...

Gimme siren, child and do you hear me?
Gimme siren, child, and do you hear me call?
Sing, child, of right and wrong
Gimme things that don't last long
Gimme siren, child, and do you hear me call?

(Sing)
(Sing)
Hey now, hey now now, sing This Corrosion to me
Hey now, hey now now, sing This Corrosion to me
Hey now, hey now now, sing This Corrosion to me
Hey now, hey now now, sing...

On daze, like this
In times like these
I feel an animal deep inside
Heel to haunch on bended knees
Living on if and if I tried,
Somebody send me... please...
Dream wars and a ticket to seem
Giving out and in
Selling the don't belong
Well, what do you say
D'you have a word for Giving Away?
Got a song for me?

(Sing)
(Sing)
Hey now, hey now now, sing This Corrosion to me
Hey now, hey now now, sing This Corrosion to me
Hey now, hey now now, sing This Corrosion to me
Hey now, hey now now, sing...

I got nothing to say I ain't said before
I bled all I can, I won't bleed no more
I don't need no one to understand
Why the blood run hold
The hired hand
On heart
Hand of God
Floodland and Driven Apart
Run cold
Turn
Cold
Burn
Like a healing hand
Like a healing hand
Like a healing hand
Like a healing hand",annotator_x,0,0,0,0,1,0,0,1,0,0
5714ded025ac0d8aee41d48d,All In A Week,56d82e2153a7ddfc01f94e00,Fiend,1998,1990,"(talking)
What up world, this your people, the Excited Private
Fiend, better known as Sleepy Eyed Jones
I got a question to ask you, and understand me on this one
If life is a blessing, and truly a gift
Why in the hell it could end so quick
It could happen all in a week, knowI'msaying
Check this out

(Fiend)
Monday morning waking up before I brush my dogs
Loading clips to the tip why, cause haters test balls
Smoke a cess to ease it all, but I got to face pain
Push come to shove and I will, release flames
There's a war on these streets, it's the beginning of the week
Came night fall, a couple of bodies had to leak
A couple hotties had to beat them in, died a snitch
Lied in a ditch, they tried not to cry like a bitch
The eye witness, seen it all, but mouth stayed closed
Stayed at home praying, as tears drop from my nose
Suppose it was your boys, would you ride nine Tuesday
Grabbing whatever's spent even the old school uzi
Usually wouldn't be caught, doing these wrong deeds
Wednesday, wanna know, they done fucked with the wrong breed
My girl Chrissy said Fiend, why you wear a vest
Besides the life I live girl the streets is a mess, it happened all in a week

(Chorus: O'Dell vocalizing in background)
If life is a blessing, and truly a gift
Why in the hell it could end so quick
If you thinking the streets is bad, is really a myth
You'd be surprised what your ass might get

(Fiend)
Now, came Thursday, yeah my dog Rover his
The devil called who in the fuck taking care of them four kids
The more I did, with a firm grip, I couldn't shake the thoughts
I tried to drink the pain away, enough liquor wasn't bought
Saw some good news, like a quest for some gold
My girl sleeped with that other day, bless her soul
Glock I hold, got paper, wrapping niggas for nothing
Plus I'm tripping on these hoes, and get it all done with something
Blunting, to keep my composer, No Limit Soldier
Trouble seems to find me, in the Navi or the Rover
Fuck being sober, it ain't the weekend yet
Plus some jackers tried to follow, me and Serv in the Vet

(Chorus)

(Fiend)
Probably even tripping how them boys, chase the wealth
Followed to I 10 them boys sure killed theyself
Hell, been not feeling a thang, behind mine
In search of being heard they surely don't mind dying
Picture, what happens, in time on this day
Chronic got me wanting to sleep on the sixth day
Mix playing the N.Y., Vix paying the N.O.
Both, your niggas drinking, blowing some indo
Send for, Saturday, that's when the Cali play
Over that a-way, a man stand in the alley way
Make it to the club, fuck, he popping lips
Hit him, I got that torch straw anxious at my hip
Shit got thick, and real niggas had to leave
I went throwing heat, like I was in the major league
Shit, ready for combat including the gun play
The priest gone be tripping come confessions on Sunday

(Chorus - 2x)

(talking)
Better yet on our world, knowI'msaying
Understand it could happen all in a week
This for Fiend and No Limit to the world
Understand, live your life nigga",annotator_x,0,1,0,0,0,0,0,0,0,1
5714dec525ac0d8aee3a0b80,The Big E,56d7fbfa53a7ddfc01f9063f,Ass Ponys,1993,1990,"see the father's barn burning
watch as the flames
illuminate the sky
see the boy who set the fire
watch the barn burning
in his eyes in his eyes
hear the cattle calling out
into the night
they crowd against the fence
until it breaks
and as it breaks
the arson shakes
know that it's life
and nothing more

see the boy obey the father
stuffing the crying
kittens in a sack
hear the father curse the boy
and whip him with a switch
across the back across the back
see them standing on
the bridge at twilight
they tie it to a rock
and let it go
and through the tears
it disappears
and now he knows
it's life and nothing more

and through the tears
it disappears
the path is cut the way is clear
it's up the stairs
and through the door
he finds the matches in a drawer
into the barn he lights the hay
it catches quick
can't find his way
through the burning ash
and blinding smoke
he stumbles and begins to choke
a just reward a settled score
and now he knows
it's life and nothing more",annotator_x,0,1,0,0,0,0,1,0,0,0
5714dee125ac0d8aee4eb340,Untitled,56d95d30cc2ddd0c0f6b9bc3,R.E.M.,1988,1980,"This world is big _(this world is big)_
And so awake _(and so awake)_
I stayed up late _(I stayed up late)_
To hear your voice

This light is here _(this light is here)_
To keep you warm _(to keep you warm)_
This song is here _(this song is here)_
To keep you strong

 _(I made a list)_ I made a list
 _(Of things to say)_ of things to say
But all I want to say _(but all I want)_
All I really want to say is _(yes, all I want)_

 _(I made a list)_ hold her
 _(Of things to say)_ and keep him strong
 _(But all I want)_ while I'm away
 _(Yes, all I want)_ from here

 _(This world is big)_ hold her
 _(And so alone)_ and keep her strong
 _(I stayed up late)_ while I'm away
 _(To hear your voice)_ from here

 _(This light is here)_ hold him
 _(To keep you warm)_ and him strong
 _(This song is here)_ while I'm away
 _(To keep you strong)_ from here

I've seen the world and so awake
 _(Keep him strong)_
And stay up late to hear me sing
Just hold her
I've seen the world and so awake
 _(Keep him strong)_
And stay up late to hear me sing
Just hold him

 _(I 've seen the world)_ hold her
 _(And so awake)_ and keep her strong
 _(So stay awake)_ while I'm away
 _(To hear me sing)_ from here
 _(I 've seen the world)_ hold him
 _(And so awake)_ and keep her strong
 _(So stay awake)_ while I'm away
 _(To hear me sing)_ from here",annotator_x,1,0,0,0,0,0,0,0,0,0
5714deeb25ac0d8aee56dfe1,Freak Magnet,56d99130cc2ddd0c0f6be84a,Violent Femmes,2000,2000,"Some magnets attract
Some magnets repel
Some magnets say:
Hey hey what the hell
I'll take it both ways
First you come and then you go
And then you turn around
And P.A.Y.S.
It stays yes it stays no
I don't know what you're doin' here
I don't even want you near
Seem like a seem like a (uhhh...)
I'm a I'm a
I'm a freak magnet
I'm a freak magnet
I'm a freak magnet
I'm a freak magnet
And I'm callin' all the freaks
From the freak freak planet
I'm a freak magnet
Well the birds of a feather
Will fly and flock together
And the letter will come whether
It's good or bad weather
There's a cut on my knees
Cause I need to freeze
And there's a cord on my coat
Cause I neeed to cut the rope
And you're talkin' like sleeze
And you're lookin' like disease
Seem like a seem like a (uhhh...)
I'm a I'm a
I'm a freak magnet
I'm a freak magnet
I'm a freak magnet
I'm a freak magnet
And I'm callin' all the freaks
From the freak freak planet
I'm a freak magnet
I don't wanna date you ooo
I don't wanna rape you ooo
I don't wanna kiss you ooo
I will never miss you
because
Some magnets repel
And some magnets attract
And some magnets retreat
And then attack attack attack
I want it both ways
First I come and then you go
And you're the one of us who pays
Who says yes? I says no!
I don't even want you here
what the fck you doing here
Seem like a seem like a (uhhh...)
I'm a I'm a
I'm a freak magnet
I'm a freak magnet
I'm a freak magnet
I'm a freak magnet
And I'm callin' all the freaks
From the freak freak planet
I'm a freak magnet
Seem like a seem like a (uhhh...)
I'm a I'm a I'm a
Seem like a seem like a (uhhh...)
I'm a I'm a I'm a
Seem like a seem like a (uhhh...)
I'm a I'm a I'm a
Seem like a seem like a (uhhh...)
I'm a I'm a
I'm a freak magnet
I'm a freak magnet
I'm a freak magnet
I'm a freak magnet
I'm a freak magnet
I'm a freak magnet
I'm a freak magnet
I'm a freak magnet
And I'm callin' all the freaks
From the freak freak planet
I'm a freak magnet
Babe I'm callin' all the freaks
From the freak freak planet
I'm a freak magnet
Yes I'm callin' all the freaks
From the freak freak planet
I'm a freak magnet",annotator_x,0,0,0,0,0,0,0,0,0,1
5714dee225ac0d8aee4fc896,Stars Of Africa,56d963c4cc2ddd0c0f6ba582,Roger Whittaker,2005,2000,"When the stars of Africa shine down on me
And the dome of heaven seems to fill my mind,
Than I thank the lord that I'm alive and free,
Where the stars of Africa shine on me.

In the gentle evening, by the firelight glow.
I'm filled with wonder, that of all man kind.
Fate has placed you here, just where you ought to be,
Where the stars of Africa shine on me.

So stars, send your message to two tiny people,
Alone on this small place, called earth.
It seems that you're trying to tell humankind,
That love is the reason for laughing and crying
And living and dying and birth.

Oh stars, can it be that you speak,

To those who have fallen in love.
For we are in love and we hear your song.
Oh stars. . .

Oh stars of Africa, so bright so vast.
I can feel my spirit move, it's so profound.
And the word that's flowing from the stars to me,
Is bless your love eternally.

Hear the stars and see them shine,
They tell me I'm yours and you are mine.
Hear the stars, hear what they say,
Love and life are all that matter anyway,
Anyway. . .

Baba, baba tu endee, tu endee Africa,
Tu endee Africa, tu endee, tu endee.

Yeah, baba, baba tu endee, tu endee Africa,
Tu endee Africa, tu endee, tu endee. . .
Africa!",annotator_x,1,0,0,0,0,0,0,0,1,0
5714ded725ac0d8aee477778,Introduction To The Opposites,56d852d953a7ddfc01f982a1,Kid Dynamite,2000,2000,"If you had your way Jim Crow would dance again.
Make a mockery of what happened way back when segregation rained and thunder
covered cries.
Any other words will never justify.

Tell me who's to blame, because I'm choking on your rage.
You fucking disease.
You sicken me, when your hate's shoved down my throat, again and again and
again.

Tell me that you've earned superiority. Every word you say is plain ignorant
to me.
Totally ignore our country's history - and the future, which you spite, for
it's equality.

Tell me who's to blame, because I'm choking on your rage.
You fucking disease.
You sicken me, when your hate's shoved down my throat, again and again and
again.

I'll spell it out:

So, it bothers me, that when you open up your mouth, derogatory, ugly rhetoric
comes out.
Well, your rhetoric is something I can do without, your stupid jokes don't
seem too funny to me.

I get the feeling that you're sick of hearing about the fight, well then just
close your ears, and I'll fucking scream it every night until you learn, or
until you walk away.

Then that, my friend, would be humorous to me.",annotator_x,0,1,0,0,0,0,0,1,0,0
5714ded225ac0d8aee437fa3,Waiting For The Light To Turn Green,56d8390453a7ddfc01f95d21,Gretchen Peters,1996,1990,"It's raining in my coffee cup
Comin' down since I got up today, cold and gray
And lookin' in my rear view mirror
I could be anywhere but here I am, traffic jam

All these people without names
Everyday we face the same routine
Waiting for the light to turn green

The lady in the blue sedan
Combs her hair and steals a glance at me
Who is she? Does anybody hold her tight
Or does she spend her days and nights at home all alone

And over in the passing zone
All wrappedi up inside their own daydreams
They're waiting for the light to turn green
Do they wonder who I am?
Do they know I'm not some damn machine
Waiting for the light to turn green?

What about the love I long for?
What about the child I want someday?
Where are they? What about my heart's desire?
What about these four bald tires I'm on? How long?

I've been goin' nowhere fast
Runnin' out of time and gasoline
Waiting for the light to turn green
I'll be damned if I'll grow old
Waitin' for these wheels to roll, not me
Waitin' for the light to turn green",annotator_x,1,0,0,0,0,0,0,0,0,0
5714deec25ac0d8aee579864,The City,56d9959ecc2ddd0c0f6bef4a,Wu-Tang Clan,1997,1990,"(unknown conversation which carries over from the last track)
That's black?
Whattup God?
Aiyyo Shorty got beef with that nigga? Word?
*blam, blam blam* Oh shit!!! Yo!
Hold the fuck up

Aiyyo yo, eight niggaz down (just enough)
Fuckin around with my sound (ci-ty)
Yo, bring backup (ci-ty)
Fuckin with me, and mine
Murderous

(Inspectah Deck)
Check it, yo
The world is shifty, we livin just enough for the city
The rough witty killa bee sting just like the jiggy
My Family Stone, foes attempt to gradually clone
Label them my anus and the casualty's home
It glows coffin, Wu stormin like the light brigade
ride the wave like Frankie Avalon
As I decipher AIDS crime pays
The law's long arm be tryin to strongarm, walkin timebombs
before I bomb firearm
The chalm smoker, I hit the dread with a poster
He toke with his own love and expose the black toaster
Composer was shook
I took your bad looks for joke get your back broke
Deep throat this murder I wrote
The antidote be seekin like a buried treasure
By every measure lethally inject your whole sector
Wanted dead or alive
Rebel I escapes across the desert sand
leavin no footprints to trace
Keep a war face, in your place
Conceal the baby knives on the North breaks
I still shine in shady times

Yeah, yo
We livin just enough (livin just enough)
Just enough (in the ci-ty)
Just enough, for the ci-ty

Yo, in the jungle
I make moves like Iron Monkey
Plots to bump me off D.O.T. be on the hunt for me
We stay hungry, for money drugs and guns
Ones who fake get caught in the crossfire for crumbs
Know the science be my Goddess
The facts tell gats sell like sex and violence
And break the project silence, a vision
This is way beyond four corners, escape this mental prison
Before we're all goners, now embrace the world
for the world war is ocean bomber
Visionary soldier comma
My code of honor, mind still start from the drama
Trauma sent the victim, witness them run, scream in horror
Military chopper come gun down the slum
The outcome do or die Son it's bound to come
Mentally aware I see truth within the square
The future's here catch me on computer software
Warfare's inevitable, Rebel I hold several government official
It's a thirty-eight special, that steps through
Like Nat Turner create a spectacle
I may die in the scuffle but I'm takin forty devils

We livin just enough
Just enough
Just enough
For the ci-ty

Killa beez, sting McEEEZ, yeah, Wu",annotator_x,0,1,0,0,0,0,0,1,0,0
5714ded825ac0d8aee47ea7e,Put That On Something,56d855a653a7ddfc01f986d0,Kurupt,1998,1990,"(feat. Freeze)

(Intro)

(Verse 1: Kurupt)
When the acid rain falls
Your frame falls
I'll make your chains spark the lead, the chainsaws
I'm not captivated
And I'm not captive
Free as a bird to fly out on Perv
Ain't here for no frontin'
Just to say a little somethin'
Rack up the gauge, spray a lil' something'
My momma always told me
Right before she'd hold me:
""Look, don't tell me... Don't say it... Just show me""
Over and over again
It sunk in slowly
I'm a... bomb shell
Bomb-o-rama, high times is proper
I'm eqipped with 4 clips
And all the accessories
For all them Sesame Street G's
That pestin' me
Not servin' neccessaties
In the battle, I'm raw
Galactica, mother
Light 'em up like battle star
Galactica, mother

(Chorus)
I'ma show you how I do it over here (over here)
If you show me how you do it over there (over there)
I'm 'bout to get a meal ticket
Put that on something
I'm about to get payed
Put that on something
I put that on my momma
Put that on something
That's on e'rythang
Nigga, put that on something
I'm about to get a meal ticket
Put that on something
I'm about to get payed
Put that on something
I put that on my momma
Put that on something
That's on e'rythang
Nigga, put that on something
Put that on something...
Put that on something...
Nigga, put that on something...

(Verse 2: Kurupt)
I put that on my shoes and sox
My moms and my pops
My bomb drops, my 5 glocks, and my knots
How you gonna tell me what I'm gonna do?
When I'm not
When I'm hot
Is when you can consider it got
In one false move
Is when the vaults move
Cracked in the middle like eggs
Spread on the table
Your pulse halts
Boy, get your game together
This ain't to die together
?This ain't the ain't together?
Now ain't this somethin'?
A youngster just swerved up
The homie just swerved up
Hold up!
I'ma be goin' tonight
I ran into the homies
It's on tonight
I gotta throw on my stars and my khakis tonight

(Chorus)
I'ma show you how I do it over here (over here)
If you show me how you do it over there (what?!)
I'm 'bout to get a meal ticket
Put that on something
I'm about to get payed
Put that on something
I put that on my momma
Put that on something (Really?)
That's on e'rythang
Put that on something (For real)
I'm about to get a meal ticket
Put that on something
I'm about to get payed
Put that on something
I put that on my momma
Put that on something
That's on e'rythang
Put that on something
Yeah...
That's on the Pound, nigga
Put that on something
Fool, put that on something...

(Verse 3: Kurupt)
I know a few of y'all could ?? the time to spit off
After bustin' lead off
Knockin' a nigga head off
Fa sho
Hard core, fa sho
Predator
Mentor
?Antra entrepenuer?
Radical and raw assasin, maskin'
Caskets and drastics tactics
Quick
To flip 'em like bricks
Put a little soul in your strive, home boy
If you ever think about tryin' to ride, home boy
Caticalism
Reactions leads to another food up
Fool across the across the bridge with six kids, get clips
And everything 'quipped with that
Like Daz said: ""Retaliation, Revenge & Getback""
Like Daz said: ""If you ever need me homie, you know what to do""
If I never said it before, the same applies for you
(This one's for yooooou)

(Chorus)
I'ma show you how I do it over here (over here)
Now y'all show me how you do it over there (over there)
I ride with the West Coast (West Coast)
Put that on something
I ride with the East Coast (East Coast)
Put that on something
I put that on my momma
Put that on something
That's on e'rythang
Put that on something
I ride with up north (Up north)
Put that on something
I ride with the dirty south (Dirty south)
Put that on something
I put that on my momma
Put that on something
That's on e'rythang
Fool, put that on something
Yeah...
Nigga, put that on something...
Put that on something

(Outro: Kurupt & Freeze)
I put that on the hood
Put that on something
I put that on my kids
Put that on something
I put that on my life
Put that on something
I put that on e'rythang
Put that on something
I put that on my grandkids
Put that on something
I put that on e'rythang
Put that on something
I put that on my life
Put that on something
Put that on something
Put that on something
Is that right? (Oh really?)
Put that on something then... Huh?!
Put that on something you love
Something that you care about
Something that you would never give up
Put that on something
Put that on something
Put that on something
(I put that on my kids)
You know what I mean?
Put that on something, homie
Huh?
Put that on something...
(Repeat over and over 'til end)",annotator_x,0,1,0,0,1,0,0,0,0,0
5714deeb25ac0d8aee570564,Dragging My Own Tombstone,56d99219cc2ddd0c0f6be9ab,Waco Brothers,2000,2000,"Snapping the chains now what a relief
I'm climbing back out from right underneath
Into the world of sweet delight
Well I gave up without a fight
And I feel like I've been
Dragging my own tombstone Dragging my own tombstone
Dragging my own tombstone Most of my life

I could handle toil and trouble
When it brought better times
But time hangs heavy on my hands
Slipping by me, over again on that production line

Not lost for the working man
You let that chisel fall from your hand
Now is the time to pick your fight
I can't make everything right
And I feel like I've been
Dragging my own tombstone etc.

At the heart of a brand new city
I will find that precious jewel
Just drove in from Indiana
The neon canyons, calling home another fool

Old stinking hat and shoes
Fat white suburban blues
In this world of sweet delight
I'll give up without a fight
And I feel like I've been
Dragging my own tombstone etc.

Here's the carrot and here's the stick
Here's the throat where the big words stick
See the hammer and the tongs
I've been doing this too long

There's about a hundred people in a windowless concrete shed
They've come in here to blow that paycheck, blow the rent
Came to remember coming back to forget",annotator_x,0,0,0,0,0,0,0,0,0,0
5714dedb25ac0d8aee4a956c,Message No. 419,56d93bf9ce06f50c0fed84e9,MC Frontalot,2005,2000,"It was just like a scene in an intrigue film
and I'm still not convinced that it wasn't for real.
It was just like a scene in an intrigue film
and I'm still not convinced that it wasn't for real.

Got message number 4-1-9...
Got message number 4-1-9...
Got message number 4-1-9...
This lucky day is mine, all mine.

This isn't intended for me, I don't think.
It's a missive from the edge of despair, I mean brink
of total desperation; the communication therein
says her hopes for survival are slim
and she's writing to the Front, though we've yet to meet,
with a confidential matter cause she's heard I'm discreet.
And the urgency of her request for my aid
is matched by the depth of the trust she displayed.
""Don't betray me like our oil minister did, staged a coup
and I'm about to flee Nigeria soon
but I'll never make it out,"" she says, with twenty million
three hundred twenty thousand U.S. dollars that are still in
her possession. She embezzled them, I guess.
Look, I don't really know her so uh... that's none of my business.
She's the LADY MARYAM ABACHA, deposed.
These days can't even get her caps-lock key unfroze
but yo, something 'bout a widow in distress
(with 20 million dollars hidden in a metal chest)
softened up the Frontalot's heart no doubt
so I hit the reply button, tell her I can help her out.

Got message number 4-1-9...
Got message number 4-1-9...
Got message number 4-1-9...
This lucky day is mine, all mine.

Got message number 4-1-9...
Got message number 4-1-9...
Got message number 4-1-9...
This lucky day is mine, all mine.

She writes me back: DEAR FRONTALOT, UNITED STATES...
She acts so thankful. A bank full of money awaits!
And I hate delays so I'm quick to turn around
with my full name and the number to my checking account
and the scan of my license to drive an automobile
and my passport number proving Frontalot's for real!
Then I'll meet the money in Stockholm, ain't gonna walk home,
think I'll retire to the south of Spain and sip gazpacho.
Not so quick, there's a little problem.
LADY A apparently had difficulty running all them
numbers I give her, but look, the fake ID's my only one
and that's a real passport, I got it off usenet and checked,
I'm not dumb. I'm not some idiot
who's about to lose your money for you, quicker than I'm getting it
and of course my bank balance is negative, whose isn't?
It's why I need your 20% money laundering commission.
And I'm wishing I could talk about this further with you but I can't.
I just got an email from DR. UBUGU of Chad.
He's got a hundred and seventy-seven million in a bag.
I feel I got to help him 'cause his story is so sad.

Got message number 4-1-9...
Got message number 4-1-9...
Got message number 4-1-9...
This lucky day is mine, all mine.

Got message number 4-1-9...
Got message number 4-1-9...
Got message number 4-1-9...
This lucky day is mine, all mine.

It was just like a scene in an intrigue film
and I'm still not convinced that it wasn't for real.
It was just like a scene in an intrigue film
and I'm still not convinced that it wasn't for real.",annotator_x,0,0,0,1,0,0,0,0,0,0
