song_id,song_title,artist_id,artist_name,song_year_combined,song_decade_combined,lyrics,Annotators,is_care,is_harm,is_fairness,is_cheating,is_loyalty,is_betrayal,is_authority,is_subversion,is_purity,is_degradation
5714ded625ac0d8aee46f170,Love Me,56d84f3253a7ddfc01f97d06,Justin Bieber,2009,2000,"Oh oh, oh oh
It's JB (JB)

My friends say I'm a fool to think
That you're the one for me
I guess I'm just a sucker for love
Cause honestly the truth is that
You know I'm never leaving
Cause you're my angel sent from above

Baby you can do no wrong
My money is yours
Give you little more because I love ya, love ya
With me, girl, is where you belong
Just stay right here
I promise my dear I'll put nothing above ya
Above ya

Love me, Love me
Say that you love me
Fool me, fool me
Oh how you do me
Kiss me, kiss me
Say that you miss me
Tell me what I wanna hear
Tell me you love me

Love me, love me
Say that you love me
Fool me, fool me
Oh how you do me
Kiss me, kiss me
Say that you miss me
Tell me what I wanna hear
Tell me you love me

People try to tell me
But I still refuse to listen
'Cause they don't get to spend time with you
A minute with you is worth more than
A thousand days without your love, oh your love

Baby you can do no wrong
My money is yours
Give you little more because I love ya, love ya
With me, girl, is where you belong (belong)
Just stay right here
I promise my dear I'll put nothing above ya
Above ya

Love me, love me
Say that you love me
Fool me, fool me
Oh how you do me
Kiss me, kiss me
Say that you miss me
Tell me what I wanna hear
Tell me you love me

Love me, love me
Say that you love me
Fool me, fool me
Oh how you do me
Kiss me, kiss me
Say that you miss me
Tell me what I wanna hear
Tell me you love me

My heart is blind but I don't care
'Cause when I'm with you everything has disappeared
And every time I hold you near
I never wanna let you go, oh

Love me, Love me
Say that you love me
Fool me, fool me
Oh how you do me
Kiss me, kiss me
Say that you miss me
Tell me what I wanna hear
Tell me you love me

Love me, love me
Say that you love me
Fool me, fool me
Oh how you do me
Kiss me, kiss me
Say that you miss me
Tell me what I wanna hear
Tell me you love me","annotator_x, anotator_y",1,0,0,0,1,0,0,0,0,0
5714dedb25ac0d8aee4a28c9,Johnny Was A Rebel,56d9391ace06f50c0fed80b1,Mark Collie,1991,1990,"Johnny came home in '67 to a little bit less than a heroe's welcome
Guns of war ringing in his head I wonder what he must have thought
Johnny was a rebel alright it was in his blood like fire in his eyes
About the things some people said

Believin' that freedom was well worth keeping alive
Johnny was a rebel alright he knew where to stand and where to fight
Believin' that freedom was well worth keeping alive

Johnny was a rebel alright
He used to ride that Harley through the hollows and the hills
Blow through town standing on one wheel
Long hair flyin' like a sheet in the wind I knew he never would fit in
In the old hometown again

Yeah Johnny was a rebel alright...

That night out on the courthouse yard behind the civil defense and the
national guard
I saw an angry mob get out of hand I saw Johnny take a bullet for another man

It seems like a waste when I look back today but I guess it's like he used to
say
Johnny died young like the good often do fightin' for right in the struggle of
truth
Our freedom's only worth as much as we're all willing to pay

Johnny was a rebel alright Johnny was a rebel alright yes he was
Johnny was a rebel alright yes he was Johnny was a rebel alright yes he was","annotator_x, anotator_y",0,0,0,0,1,0,0,1,0,0
5714deea25ac0d8aee55abaa,Something In My Heart,56d98925cc2ddd0c0f6bdc6e,TKA,1990,1990,"I just don't know what this feeling is,
It's such a funny feeling
I know I never felt, this way before
And every time I'm near you,
My fantasies just seem to take control
And each day I'm with you,
The fire inside me grows and grows

And when I hold you in my arms
I feel so strong inside
You have become such a part of me,
Your love just won't set me free because

(chorus)
There's something in my heart
(Something in my heart)
Is telling me you are the one
Something in my heart
(Something in my heart)
Is telling me you are the one I need

I just can't go on, pretending I'm not in love
Each day of my life, and each of every minute
You're the one I'm thinking of,
And when we're alone nothing else
Matters but you and me,
And I know together come what may
We can face anything

And when I hold you in my arms
I feel so strong inside
You have become, such a part of me
Your love just won't set me free because

(chorus)
There's something in my heart
(Something in my heart)
Is telling me you are the one
Something in my heart
(Something in my heart)
Is telling me, you are the one I need!

And when I hold you in my arms
I feel so strong inside,
You have become, such a part of me
I can't no longer hide.....

(chorus)
There's something in my heart
(Something in my heart)
Is telling me you are the one
Something in my heart
(Something in my heart)
Is telling me, you are the one I need!

(repeat chorus)","annotator_x, anotator_y",1,0,0,0,0,0,0,0,0,0
5714dede25ac0d8aee4c6775,Feel Like I'm In Love,56d94e5fcc2ddd0c0f6b8635,Nicole C. Mullen,2008,2000,"You say, ""I dont look at you, the same way that I used to.""
I say, ""I just want romance, like this novel in my head.""
You say, ""Baby, now you know you can't believe, every little thing you read""
And I say, ""Yeah I know it's make believe, but the feelings can be achieved.""
""So tell me what I can do girl, to let you know my love is true.""
And I say, ""There's only one thing that I want:
I wanna feel like I'm in love (with you),
Wanna sing like I'm in love (with you),
Wanna dance like I'm in love (with you),
Take a chance like I'm in love (with you).""

Say I dont smile at you the same way that I used to,
I say I just wanna know, how much you love me Romeo.
Love me more then all the pretty girls you see, walk around on the TV
How about your favourite things, do you love me more then these?

""Tell me what I can do girl to let you know that my love is true""
And I say there's only one thing that I want,
Only one thing that I want,
Only one thing that I want,
I wanna feel like I'm in love (with you)
Wanna dance like I'm in love (with you)
Wanna smile like I'm in love (with you)
Romance like I'm in love (with you)

You know baby, now you know,
You cant believe my volume to reality,
Now it ain't make believe,
The feelings can be achieved,
And I'll show you what I'm gonna do
To let you know my love is true,
'cuz your the one thing that I want,
The one thing that I want,
The one thing that I want.

I wanna feel like I'm in love (with you)
I wanna sing like I'm in love (with you)
And I dance like I'm in love (with you)
Romance like I'm in love (with you)
And I sing like I'm in love (with you)
Do this thing like I'm in love (with you)
I smile like I'm in love (with you)
Gunna stop 'cuz I'm in love (with you)

OH!
With you x 4","annotator_x, anotator_y",1,0,1,0,0,0,0,0,0,0
5714ded725ac0d8aee47b90c,Who Do You Think That You're Fuckin Wit,56d8546353a7ddfc01f984f5,Knightowl,1998,1990,"(Knightowl (Talkin))
Hey what's up you fuckin bitch
Now look at your sorry punk ass
(car screechin off)
I'd like to dedicate this song
To all them punk mothafuckas
That be talking shit
Even though they know
They ain't bout a god damn thing
Fuck you and fuck all those that surround you
You weak ass little bitch
And to all those mothafuckas that don't like
What I speak, choke on a fat ass dick
And to those that wanna step to my boy Chris Gunn
Watch that ass mothafucka

(Knightowl)
Fool think about who you fuck wit
You can't step to me
And get away with that bull mothafucka
Knightowl be the one to put a gat inside your mouth
I'll smoke that ass then head south
It's that criminal bringin all those putos drama
Bitch made niggas get broke like a ramma
I'ma put em in the house of pain
Without a brain it got blown out
Now it's mothafuckin lights out
So anybody that'll try to disrespect me
Best believe ain't nobody bad enough to thee
Not so nice, given a fuck about life
Roll that ass like some dice
You must pay the price
Nobody's able to bust things the way that I do
I got this for you and you're mothafuckin crew
A chrome fuckin peace that'll spit to the head
Lot's of mothafuckin lead, leavin all putos dead

(Chorus: Chris Gunn)
Who do you think
That you're fuckin wit
I'll put a bullet inside your dome
Who do you think
That you're fuckin wit
I'll never let you make it home

(Knightowl)
Second time around but you still think you're tough
You tried to call a bluff and to that you got snuffed
Life ain't nothin but a mothafuckin dream
Come try and battle, go ahead bring on the whole team
I'm the man that'll fight him, I out right em
Puttin my shit down for the mothafuckin brown
Puttin slugs in all you sons of bitches
Punks like you get dropped off wearing stiches
I don't fuck around, never play, never will
My intentions, you know be to kill
Anybody that'll wanna come try
This mothafuckin lokness
Eyeballs up on the scope and I'm focused
I never lost a battle and behind my own shadow
I'm fatal like a mothafuckin rattle
I stick and move to those that'll test
I bust them 38 slugs in your chest

(Chorus)

(Knightowl)
Poppa don't take no mess so call me daddy
I'll snatch a mothafucka right out his caddy
Then put a bullet in his dome
That shit be on, don't mad dog or look at me wrong
Cause I'ma put that ass inside a freezer
Direct to the morgue you'll be stiff as a board
So when I see that ass up close
You best run little bitch, I knows you's a snitch
You wanted to battle
But you become the fuckin victim
And not a damn thing changed as I ripped him
In two, what the fuck you gonna do about
When the gun's on my lap
And the demon's bustin caps
Run, just like that little bitch that you be
Stop tryin to be like me, I'm O.G.
You'll be unreliable, I'll be uncontrollable
All the shit I say is qouteable

(Chorus)
(2x)

(Chorus 2: Knightowl)
I don't think you wanna fuck around
With the mothafuckin Knightowl
Cause you might get smoked
I'll put you in plastic inside of a casket
Your mothafuckin face with a shotgun I blasted
(2x)

(Chris Gunn)
Who do you think
That you're fuckin wit","annotator_x, anotator_y",0,1,0,0,0,0,0,1,0,1
5714ded725ac0d8aee474fa1,Protect My Heart,56d851bd53a7ddfc01f980da,Kelis,2003,2000,"I gotta protect my heart
I gotta protect my heart

You were the heart of the spot
But you wouldn't tell me your name
You were like
Girl you ready or not
To dance the entire night away
You and I

Let me hold you girl, hold you girl
You were sayin'
Let me touch it girl
You were sayin'
Let me squeeze you girl, squeeze you girl
You turned me on
Let me... you girl

So when I first got here I knew already
I gotta protect my heart
And then you come change things, I knew that's unfair babe
I gotta protect my heart

The room is oh so hot
If you want more than that then walk away
I'm givin' it all I got
And at the same time tryin' to make ten

You were like
Let me hold you girl, hold you girl
You were sayin'
Let me touch it girl
You were sayin'
Let me squeeze you girl, squeeze you girl
You turned me on
Let me... you girl

So when I first got here I knew already
I gotta protect my heart
And then you come change things, I knew that's unfair babe
I gotta protect my heart
Never been touched by the way someone moves and that scares me
I gotta protect my heart
Never knew that you were comin', you should've prepared me
I gotta protect my heart

I just need ta
I walked away from the door
I could feel myself reversing
I never gave in before
See I guess that's what I've been
When you were like

Let me hold you girl, hold you girl
You were sayin'
Let me touch it girl
You were sayin'
Let me squeeze you girl, squeeze you girl
You turned me on
Let me... you girl

So when I first got here, I knew already
I gotta protect my heart
And then you come change things, I knew that's unfair babe
I gotta protect my heart
Never been touched by the way someone moves and that scares me
I gotta protect my heart
Never knew that you were comin', you should've prepared me
I gotta protect my heart

Break it down

See when I first got here I knew already
I gotta protect my heart
And then you come change things, I knew that's unfair babe
I gotta protect my heart
I gotta protect my heart
I gotta protect my heart","annotator_x, anotator_y",1,0,0,0,0,0,0,0,0,0
5714ded025ac0d8aee41f15e,World View,56d82ee153a7ddfc01f94f5f,Flame,2007,2000,"Yea, it's a lot of suffering going on in this world
A lot more than what we see in America
I think it's just healthy to be aware
So I want to take you with me
As we travel the globe
And see the problems and see the pain
And see our only hope
Is through Jesus Christ
To redeem our world, let's go

See it's more suffering in the world
Than we see on the streets
Open your eyes step away from MTV
See into CNN and see in the Middle East
Places like Iraq, Iran, the UAE
See the murder
The rape
Religions
The pain
The terror
The poverty diseases in the veins
See our desperate need for change as we travel the globe
And see our only hope is Jesus grabbing a soul
Look at Africa actually one of the places
Where 24 million people living with AIDS is
Where rape is half of the women experience violence
Orphans guerilla warfare break the silence
Vulnerable African children go hungry
While we in the states we waste money
12 years olds traded for sex
We need Jesus what type of suffering is next
Even Europe has problems
Think a place like Greece
Where they smuggle Cannabis and heroin from the Middle East
The assaults the car theft and drug offenses
Illicit drugs and rape exist
Though they can never rate with the USA
We number 1 on the list for most criminal cases
Though we living in the free land and free to vote
But yet we still slaves to sin?
Welcome to I-N-D-I-A
Where 63 out of a thousand children die before the age of 5
5.1 million people with AIDS alive
Mad pollution in the Asian sky
Millions of children live and they work and on the streets
One of the poorest countries that this world will ever see
And 10 million babies died from abortions in two decades
That's more of a reason for you to get saved
Look at China and see the way they treat the females
They drown them and poison them
I give you the details
It overwhelms me the magnitude of they sinning
When over 60 million babies never grow to be women
Violent crimes on the rise prostitution is rising
Drug addition plus they persecuting they Christians
The most populated country with 3 billion people
Needs to look up so they can see the point like a steeple
In Israel
Terrorism is real
Can't imagine the amounts of blood that gets spilled
Many people displaced from the bombs dropping
Judaism Christianity Islam's doctrine
Civil war taking place in the Holy land
While peoples homes getting crushed like a soda can
As the children sit and watch the crossfire
Other countries plead for peace to cease fire
Jamaica Wah Gwan
I guess I get to tell
15 percent of the people have sickle cell
In this third world where gang violence is
It's prevalent, it's evident all the Godlessness
The drug traffic ganja and cocaine
With so much cocaine you can skid on a slope main
But when Jesus Christ died recognize that hope came
So fight the sex trade and racism for sho main
See in Cuba people submerged in repression in fear
From 48 years Fiedel Castro is their Prime Minister Counsel of ministers
Also referred to as Premier
Prostitution is high and the crime is too
Can't express your ideas like you and I can do
In America democracy is what we're use to
But I'm just trying to remind you that
See it's more suffering in the world than we see on the streets
Open your eyes step away from MTV
Sin to sin in the sea in the Middle East
Places like Iraq, Iran, the UAE
See the murder
The rape
Religions
The pain
The terror
The poverty diseases in the veins
See our desperate need for change as we travel the globe
And see our only hope is Jesus grabbing a soul","annotator_x, anotator_y",0,1,0,0,0,0,0,0,0,1
5714ded525ac0d8aee4610b6,"O Come, O Come Emmanuel",56d849a953a7ddfc01f975a4,Joan Baez,2006,2000,"Oh, come, oh, come, Emmanuel,
And ransom captive Israel,
That mourns in lonely exile here
Until the Son of God appear.
Rejoice! Rejoice! Emmanuel
Shall come to you, O Israel!

Oh, come, our Wisdom from on high,
Who ordered all things mightily,
To us the path of knowledge show,
And teach us in her ways to go.
Rejoice! Rejoice! Emmanuel
Shall come to you, O Israel!

Oh, come, oh, come, our Lord of might,
Who to your tribes on Sinai's height
In ancient times gave holy law,
In cloud and majesty and awe.
Rejoice! Rejoice! Emmanuel
Shall come to you, O Israel!

Oh, come O Rod of Jesse's stem,
From ev'ry foe deliver them
That trust your mighty pow'are to save,
Bring them in vict'ry through the grave.
Rejoice! Rejoice! Emmanuel
Shall come to you, O Israel!

Oh, come, O Key of David, come,
And open wide our heav'nly home,
Make safe the way that leads on high,
And close the path to misery.
Rejoice! Rejoice! Emmanuel
Shall come to you, O Israel!

Oh, come, our Dayspring from on high,
And cheer us by your drawing nigh,
Disperse the gloomy clouds of night,
And death's dark shadows put to flight.
Rejoice! Rejoice! Emmanuel
Shall come to you, O Israel!

Oh, come, Desire of nations, bind
In one the hearts of all mankind,
Oh, bid our sad divisions cease,
And be yourself our King of Peace.
Rejoice! Rejoice! Emmanuel
Shall come to you, O Israel!

Hymn # 31 from Lutheran Worship
Author: French Processional
Tune: Veni Emmanuel
1st Published in: 1854","annotator_x, anotator_y",0,0,0,0,1,0,0,0,1,0
5714decb25ac0d8aee3e90cf,Bada Bing,56d8195453a7ddfc01f93019,Danger Doom,2005,2000,"(MF Doom)
Not a lot of bling
When he do the thing, bada boom, bada bing
From the womb to the tomb
Get that ricotta, bada bing, bada boom
Doom, your reputation precedes you
Wail 'til you crack and see what ""weed"" do, you dweeb you
No pun intended, takes one to know one, will know - it's unscented
Yo son, demented when them sent it from the other time
Before everybody and they mother rhyme
What a crime - beats is the same way
Make 'em wanna hit the streets with the heat for a lame's pay
Game day, flag on the play, improper helmet
Drag on the suede from the gem drop of well spit
He didn't listen, titty kissin the city glistened
Depending on what from what position you're sittin
In the pissy wind, is this thing whistlin?
Who let the spinnin whisperin djinn in?
The Villain again? Without a doubt
That's his name, don't play it out
Or spray it, when you say it out your mouth
Then gave him a cold shoulder for a hour
And told him take a gold shower, for fakin funk, soul power
... stocky, short and cocky
Looked like Apollo Creed after he fought with Rocky
Rhymed in a broken english slang, not cockney
Thirteen, his first queen wore hot knock knees
Had to tell her pops, yo stop cockblockin B
Hold somethin for your daily yay habit
Then go, bada-bing-bing-bing like ricochet rabbit
How 'bout the sicko say stab it?
There's liquor in the cabinet and a slicker for the crap pit
And Heineken, I told him much obliged friend
What I gotta spend, if I only touch her thighs then?
... why his eyes widened
He didn't know your man had a nice surprise hidin
Took pride in ridin in a sly wiseguy grin
... real recognize real
On the microphone, the wheels are mechanized steel
Please, at least respect your ideals
How you got her walkin along the stroll in high heels?
He said her mamma was gettin old
God bless her poor soul, now no more drama is your role
Straight to the head
He know a lot of haters can't wait 'til he dead
Lead to go, like a ho, to a strange whack housewife
Only thing he know will change his back do', how trife
Rules is rules, don't go there
Stay on sale like a old coat made of mohair
Keep a snotty chicken on E, the Lone Ranger
Why everybody always pickin on Danger?
... and Doom, maybe it's him
Called up my lady, told her baby it's slim
Make me up a margarita I need to take a swim
Tell them kids remember school - if they let 'em out, cool
But get the hell from out the pool

(*BEEP!!*}

(Master Shake)
Hey {shithead}, it's me again!
And you know what? I just heard, IT'S ALL DONE NOW!
And somehow, I guess you must have lost my number
You know what?! YOU SUCK!
YOU SUCK! YOUR MUSIC SUCKS!
AND I HATE YOUR SUCKY STUPID METAL FACE!
I hope you BURN, you're going DOWN
This is the last big mistake, you'll ever make
YOU SUCK!!! I HATE YOUR GUTS!
...
But, if there is another project in the future please keep me in mind
Thank you

{*phone hangs up*}","annotator_x, anotator_y",0,1,0,0,0,0,0,0,0,1
5714dec625ac0d8aee3ab8ee,G.a.m.e.,56d8003953a7ddfc01f90c9c,Beanie Sigel,2000,2000,"(Peedi Crakk)
Yeah, don't even wet it nigga, I got this one
North mothafuckin' Philly boy, fuckin' mafia and all that,
State Property, Peedi Crakk

And I'm G.A.M.E., so please don't tempt me
Yo that 4-5 keep holdin' your boy down,
We'll leave ya in the live, put everything in the ground,
And I ain't tryin to brag, but the S-5 pound,
Keep shittin' on the ass everytime I flex ground now
I got my moms to thank, and her boy good
I kiss her 'fore I leave then hit you up in the hood,
A nigga gon' bleed and Peedi don't need good
And I'm G.A.M.E. so please don't tempt me
This one is for my hood, my gun ain't unda the hood,
It's sittin' here on my lap, my cap is under my hood, good my aim good,
My aim good I'm doin' this like I should,
And I'm G.A.M.E. so please don't tempt me
See big up in the hood, with see's sayin he low,
Elle D took a scooter he comin' back with the smokes,
See niggas in the hood nigga beggin a niggas up in there

(Lil' Cease)
Yo, I roll wit Peedi Crakk, I drink booze wit' Free
Smoke a pound wit Young Gunnas, plus I mack wit Beans,
That was Sate P, mad south Mafia Gang,
And them slugs go sting crack a skull in yo brain
And sing yo ass a lullaby, nigga mo' money mo' problems, mo' murda, mo'
homicide
Bang, bang, Mafia Gang, we let the drama ride
G.A.M.E. so please don't tempt me
I'll pop ya cause I'm higher than paranoid,
Sometimes I feel like my niggas is hammer boys
Beat ya to a pulp, like Suge ya daddy boy
GAME so please don't tempt me
I'ma squeeze til' my clips on empty, empty,
Every piece of slug all on your Bentley,
So don't tempt me nigga, I gets busy
G.A.M.E. so please don't tempt me

(Beanie Sigel)
Well they call me be Mack,
But today I got the K, I got the S, I got the A,
I don't think you want to play, OK
My choppa clicks, hold a hundred copper sticks
And I'm G.A.M.E. wit them things off safety
I play the hood, usually up to no good,
Keep my vest on my chest, under my SP hood, I'm good
I'm layin' low and my squad are burnin' woods,
And I'm G.A.M.E., so please don't tempt me
It ain't no thing for me to swing around your block,
Wit them machines that go ahh,
Get off the scence before the cops, ain't nobody seen squat,
All they did was heard the shots
And I'm G-O-O-D, like you don't know me
Or know where I stand on ya, grown man on ya
Shot can on ya, play a block blam on ya, blam
And blast still all greasy on you,
It ain't shit to lay ya half a mil easy on you
You on them blockbusta, I'ma come block bustas
State Prop fucka, I know you cop sucka, cock sucka,
I see the bitch all in yo face,
And I'm G.A.M.E. to piss all in your face

(Young Chris)
Well they call me Young Gunna, but today I'm Mr. Chris,
Got the 357 wit the speed loaded kit, ya hit
My 3 5th, make you niggas shit and piss,
I'm wit the be -A-N-G G-A-N-G, yeah
My boy Sig got mafia boy sees, and Peedi gonna bring the Property more cheese,
please
Who gon' stop it to drop it and say (?)
And I'm G.A.M.E., you-P-S-E-T
Peedi in check, Sigel in check, Sigel got the eagle, (?) got them tecks
I know Free Wizzle got his thizzle in his vest,
And we G.A.M.E., we can BANG now
Why'all ain't a threat, why'all niggas is our pets (you muts)
You ain't a boss, why'all Young'ns gon' play fetch (say what?)
I play the charge, throw somthin' all in yo chest,
You gon are-E-S-P-E-see-T me now, now, now","annotator_x, anotator_y",0,1,0,0,0,0,0,1,0,0
5714dee725ac0d8aee5363f8,"To You, Contortionist",56d97b76cc2ddd0c0f6bc976,The Black Dahlia Murder,2001,2000,"Your eyes push shards of glass to mince my defenses
I never thought I'd feel this way - memories haunting every breath
it frightens me to know I can never be rid of you
after a year, you still stir something in me
the hate has faded but the disgust remains.
I recall when only warmth and acceptance filled your eyes.
If I could understand - what turned you against me
if I could just understand - what hardened your stare into scorn
what was it worth to you - to turn me inside out?
You became he that we hated - left me with scarlet eyes
and an empty chest - its been a year and I still feel nauseous
brown eyes cut into me - parting once friendly flesh
I burned your pictures away - but I can't stop remember when
the city has not felt the same since
though your stare has hardened - this cold contempt makes me wonder
could an ounce of guilt boil in your blood?
This blood we shared - seeps from an ever present truth
a missing piece of my past - still makes me crawl the other way
no I can't forgive - as you embody my regret
you are the living proof - that I'll never ever trust again
I never really told you what you had meant to me
ere my lungs met the ire of your voracious mouth.
So now I walk alone through the ashes of our ties.
My mind flooding with memories of endless summer drives.
I'd love to talk with you to fully understand
what finally drove you to this choice - to smash my heart
but some things are better left unsaid","annotator_x, anotator_y",0,0,0,1,0,1,0,0,0,1
