song_id,song_title,artist_id,artist_name,song_year_combined,song_decade_combined,lyrics,Annotators,is_care,is_harm,is_fairness,is_cheating,is_loyalty,is_betrayal,is_authority,is_subversion,is_purity,is_degradation
5714ded125ac0d8aee43253a,It's Not Fair,56d836cb53a7ddfc01f95a15,Glenn Lewis,2002,2000,"Cant believe
that the heart of my world
got me on my knees
prayin' my eyes are lyin to me
i built a whole new life around you
and in an instant we were through
as our future disappears
falling like tears
are the dreams of a love
i thought we shared and

[Chorus:]
It's not fair
i was true to you
i finally settle down
then you go turn around
and betray the trust i had in you
it's not fair
after all i treated you
respectable, with care
said that you'd be there
now who am i to turn to

Man, I trusted you
and this what I get in return
you was like a brother to me
but now is see you was just waitin your turn
when i'd be out at work y'all was doin dirt
stealin my heart away
shared everything with you
all i was goin through
now dark skies and tearful eyes
are here to stay

[Chorus]

After all i sacrificed
for my seed, said you'd give life
with everything i am wanted for you
to be happy, and now slowly
the life of love you breathed into my heart
is slipping away, dying today, if only
never thought i'd live to see
disrespected me, how could it be
throwin it away so easily.

[Chorus]",annotator_y,0,0,0,1,0,0,0,0,0,0
5714dee925ac0d8aee5505f9,DDT,56d984dacc2ddd0c0f6bd64e,The Suicide Machines,1998,1990,"destroy the world without a thought
destroy our lives with your bug bombs
in our food and in our blood
chemical death to the corporate slut

pollute the earth with pesticides like ddt
money, power, profit,
gain is all you CAN SEE
everyone pays when we take that route
dirty water, overcrowded
it's time to take a time out

keep your head
use your voice
speak your mind
you've got a choice
if no one cares
then nothing gets done
if no one speaks
what's done is done


pollute the earth with pesticides like ddt
money, power, profit,
gain is all you CAN SEE
everyone pays when we take that route
dirty water, overcrowded
it's time to take a time out

destroy our world!
destroy our world!
destroy our world!
destroy our world!
destroy our world!
destroy our world!
destroy our world!

we destroy our world!!",annotator_y,0,1,0,0,0,1,0,1,0,0
5714dedf25ac0d8aee4d58f0,Check It Out Ch'All,56d954c1cc2ddd0c0f6b903d,Paris,1992,1990,"That shit hittin..

Ah yes, yes y'all
(naw naw man, naw man that ain't it, that ain't it)
(do that other shit, that other shit)

Check it out ch'all, here we go again another one from the man
Known to run a record wreck and take a stand
P-Dog, kickin over breaks that make ya wanna move
It's like that when the black cat get in tune
And now you bustin' smiles when styles are ripped
So many of 'em ya discover most speakers are split
It's kinda like a little lesson in stressin' the facts
And still be kickin' so know where you at, black
Listen up to the groove of the cut
Feel the funk when the bass hump, tryin to get e niggy 'nuff
And feel it hittin' when the speakers jigglin' like Jello
With just enough of that good funky shit to keep it mellow
Never fadin' or stayin' on course
The only sellin' out I'm doin' is sellin' out tours
Somethin for your ear, comin' loud and clear
It's the voice you fear, if your shit ain't real
Keep it comin' one time for your mind on the mic it's the panther
Kickin over breaks you dance to
And doin' devils dirty lickin' lyrics to break beats
While buildin', so the children always know where they at, G

Check it out ch'all, check it out ch'all
Check it out ch'all, check it out ch'all
Check it out ch'all, check it out ch'all
Check it out ch'all, check it out

Check it out ch'all, here I come again with verse two
With the knowledge of myself I got another one from me to you
With perk tracks movin' smoother than machinery
It's plain to see I'm finna be another brother catchin' heat
I take a stand cause Amerikkka ain't shit to me
And bring ya knowledge of the way it is supposed to be
And knock you devils out the box like a mule kick
Comin' up with the shit the tricky skunks can't fuck with
Rap is rhythm and poetry I thought you knew it
But who would have ever thought that we would use it the way we be usin' it?
Spittin' facts to my peers and your fear is showin'
'Cause now the black is knowin' things you thought we shouldn't know and
Gettin ready for a power move
Yes yes y'all, ready for the motherfuckin' show and prove
So pack a lunch when the bunch roll, cause we're goin'
For the gold but I never sold my soul for it

Check it out ch'all, check it out ch'all
Check it out ch'all, check it out ch'all
Check it out ch'all, check it out ch'all
Check it out ch'all, check it out

Now - whose freedom of speech if I can't reach each
There's no support when you're black and you're goin' for yours
Yeah, that's alright
As long as niggas killin niggas makin money is nothin' for whites
That's the way they wanna play and now I know they fear it
Where the hell was little Ollie all them other years?
Blacks was dyin' in the movies and in other records
I see the racist motherfucka never said nothin'
But that's the way it is when I run it
I make the funky tracks to keep my people up on it
Well known and prone to break a bone let's get it on
I'm showin' you the facts on wax 'til your mind is grown
Huh, and still sayin' what I wanna say
I won't slip still sayin' what I wanna say
I won't slip still sayin' what I wanna say
I'm P-Dog and I'm always gonna make it plain

Huh, so check it out ch'all, check it out
Check it out ch'all, check check check it out
Check it out ch'all, check check check it out
Check it out ch'all, check check check it out

Motherfuckin right!",annotator_y,0,1,0,0,0,0,0,1,0,0
5714dedf25ac0d8aee4dd0bc,Throw Away That Shad Net,56d95782cc2ddd0c0f6b93d3,Pete Seeger,2008,2000,"Throw away that shad net, get rid of hook and line
There's no more Hudson fishing, not for a long, long time
The poison's in the riverbed, no matter whose the crime
But how are we gonna save tomorrow?

One thousand honest workers need that paycheck every week
Way up in Fort Edward where the PCBs did leak
And the GE Corporation knows the profits it must seek
But how are we gonna save tomorrow?

PCB was a clever thing, 'way back in twenty-nine
Transformers and capacitors got turned out on the line
Nobody suspected what they'd do to us in time
And now we got to worry 'bout tomorrow

Well, the purpose of technology is to take a different turn
We'll test each new thing carefully, that's one thing we have learned
We need a clean world for all to share, and all to work and earn
Then, maybe, we can save tomorrow

Well, the experts knew about it, so why not you and me
Who controls the information in this land of the free?
The laws didn't seem to help in stopping PCB
So how are we gonna save tomorrow?

The longest journey taken needs a first step to begin
This cleanup's gonna take a while, but now we must begin
Clearwater says to lend a hand, a claw, a paw, a fin
'Cause now we got to work to save tomorrow

(Spoken:) ""This song's too sad""

Here's to the lowly blue crab, because he has no fat
And so he's got no PCB (hardly) we can say, hooray for that
So I'll not quit my crabbing, you can stick that in your hat
Somehow, we're gonna save tomorrow

(Spoken:) ""In the old days, coal miners took a canary down to test the air""

Here's to the canary we took down in the mine
Here's to the Hudson stripers, may their warning be in time
Here's to all the young folks singing, ""This land is yours and mine""
That's how we're gonna save tomorrow

Oh, the glory's on the river, and the struggle's on the shore
Next year is 1976; let's start a little war
Anyone who thinks we're quitting better take just one think more
And that's how we're gonna save tomorrow

So don't throw away that shad net, don't junk that hook and line
We're gonna make some changes, we're gonna start in time
Clearwater sings to all of us, ""This land is yours and mine""
And that's how we're gonna save tomorrow
And that's how we're gonna save tomorrow",annotator_y,0,0,0,0,0,0,0,1,0,0
5714dedf25ac0d8aee4d5922,Public Enemy:Make It Hardcore,56d954c1cc2ddd0c0f6b903d,Paris,2006,2000,"(Paris)
Ain't that a bitch, I heard somebody think
Rap is dead cause people runnin out of shit to say
So ridiculous and so absurd
I was almost at a loss for words, then I started to serve
Off the line of the Enemy's mind
Back in 2005 droppin hammers without the time
Bring the ruckus from the booth to the hood
Motherfucker cause it ain't all good, now I wish they would
Get yo' vest on, we rain on Babylon
The anti-Fox News, anti-pop, original group
P and the Enemy policin the beast
Until we rise it'll never be peace, I put that on Jesus
Back with vocals, no whack shit, no glory focus
No gimmick tracks, just hard truth and rough raps
Plus that gear that keep 'em fearin the crime
Makin sure brothers knowin the time, that's why it ain't no smilin
See the army as they're snatchin us up, yeah
At yo' high school, promisin what?
Better recognize the bling of the murder machine
That's why it's meaning in the words when we serve and ask you to think
Who the whores that embed with the swords
Who the ones pimp us all sellin death for Murder Dog
The imagery is dead-ly so what the fuck?
Interscope ah better hope we never knowin and bringin the ruckus
Like Nas said, it's a coon parade, yeah
Bitch niggaz goin out all day
We pullin guns on Uncle Tom to bomb on Viacom
It's on, long as needed we competin keep-keepin it strong
Ain't no +Comic+ in my +View+ as long as they sell the black out
I grip my shit and blow your back out
We act out, cause you know we reppin the cause
Still a +Rebel+ never needin a +Pause+, I check drawers for balls

(Chorus: Chuck D) + (singers)
Whatever it takes to make it hardcore!
(Ridin with a soldier, hard truth soldiers in the game)
Whatever it takes to make it hardcore!
(Keep the record rollin, ain't nobody colder when we play)
Whatever it takes to make it hardcore!
(Hard truth soldier, ridin with a soldier in the game)
Whatever it takes to make it hardcore!
(Keep the record rollin, can't nobody hold the spot we claim)

(Paris)
Soul survivors, now tell me who can bring it liver
It's P.E., still beatin the beast
In this game of latecomers, fake friends and flakes
And grown men actin like teenagers, we raisin the stakes
What'cha know about words I throw around
When I say it loud better know that I'm black and I'm proud
+This is what I mean, an Anti-Nigger Machine+
Take a look around and see the way they keepin the realest from reachin
But I bet you never hear it again, naw
Clear Channel never heat it again
It never fit into the corporate plan of attack
They genocidal practices only givin us ""Murder on Wax""
Keep us terrified, music sterilized
Back the lies of the homicide and smile while
life imitates what we make; they all
makin money off the African's fall, that's why I'm callin out

(Chorus)

(Paris)
Because a +Nation of Millions+ is fearin the +Black+
When we +Bumrush the Show+ +The Enemy Strike Back+
With mo' game than the music and our message attract
+Revolverlution+ and +Rebirth+'ll keep the music in tact
Fuck that, bust back on they criminal ways
No compassion in they action for the son of a slave
Now the church used to hurt us, make somebody behave
Like this devil up in office really worship and pray
Like God speak to him and he does what he wants
But you know they steal the vote if anybody gets smart
The real sin is the dilemma when the people support
the death penalty but call abortion murder for sport
For the fake patri-OT, ain't no questions asked
'Specially, when the babies kill each other for gas
Known to blast on a menace that don't even exist
Set up puppet governments, for the rich to get richer
More money for them hoods, but the hood's in pain
When the schools close cause they say no money remain
Still undereducated, makin minimum wage
Got your Wal*Mart, makin new century slaves
Who's crazy? I can see, through the disguise
See, through the media's propaganda and lies
See a nation full of sheep still simple and blind
So we burn 'em with the sermon that's designed with a rhyme, we do it

(Chorus)

(Chuck D)
Whatever it takes to make it hardcore! {*2X*}

(Chorus) - second half only",annotator_y,0,1,1,0,0,0,0,1,0,0
5714deda25ac0d8aee499b47,Do You Know What You Want,56d935c4ce06f50c0fed7b8e,M2M,2000,2000,"(Come On) Know What you want.
Know what you want.

Someone to treat you right
Stay with you day and night
I can tell that's what you need. (Yeah, Yeah)

I know just what to do.
I'll take good care of you.
Baby, you can get that from me, oh.

I can tell she's not treating you right,
everytime you look at me. (Know what you want)

So which one will you choose?
You look so confused.

Tell Me the Truth:
Do you know what you want (do you know what you want)
do you know what you want (do you know what you want) what you want.

Love's so hard to find.
So Make up your mind.
Do you know what you want?

Oh baby, can't you see?
One minute you're with me...
The next one you are all over her (Yeah, Yeah)

She talks behind your back.
You know I'll stay on track.
Something she wouldn't for sure.
How can I help you to make up your mind?
Boy you're running out of time (know what you want)

So which one will you choose?
You look so confused.

Tell me the truth:
Do you know what you want (do you know what you want) yes i know what i want.
do you know what you want (give me love)

Love's so hard to find,
so make up your mind. (make up your mind)

Do you know what you want? (want)

Please call me and say (call me and say)
I am the one (I am the one)
You need in your life (you need in your life)

The game that you play (the game that you play)
It ain't no fun (it ain't no fun)
Just answer me now (gotta know what you want)

Know what you want. Know what you want. (Yeah)
(Tell Me)

I can tell she's not treating you right,
every time you look at me. (Know what you want)

So which one will you choose?
Oh, You look so confused.

Tell Me, Tell Me, Do Ya, Do Ya
How can I help you make up your mind?
Boy, you're running out of time. (Know what you want)

So which one will you choose?
Ooh, You look so confused.

Give Me the Truth:
Do you know what you want (yes i know what i want)
do you know what you want (oh, yes i know what i want)
Do you know what you want (tell me what do you want)
do you know what you want (tell me)

Love's so hard to find (love's so hard to find)
So make up your mind (make up your mind)

do you know what you want",annotator_y,1,0,1,0,1,0,0,0,0,0
5714dec325ac0d8aee386660,Home Remedy,56d7ef3456847be81b3e8be3,Adrienne Young,2004,2000,"Home Remedy

It's a home remedy when you put your arms around me
I know the working day is through
You're the right recipe never failing to astound me
Time proven tried and true

Passion flowers, love in bloom
Solar power lighting up the room
You're a soulful feeling, and my natural high
A touch of healing in the night, feels so right

You brought your laughter, I gave my trust
You showed me patience and a healthy dose of lust
Can't advertise it, can't box it up
But I have tried it and I'll never get enough of the
Things we say without a sound
The way you turn my world around

It's a home remedy when you put your arms around me
This old world is shining new
Such a sweet mystery, never failing to astound me
Time proven tried and true
Like a home remedy, oh baby put your arms around me
Sweet myster, time proven tried and true
Like a home remedy, you're my home remedy
Tried and true, like a home remedy",annotator_y,1,0,0,0,1,0,0,0,0,0
5714dec525ac0d8aee397df4,Why Is It,56d7f84453a7ddfc01f90077,Angie Stone,2009,2000,"VERSE 1
What a surprise
I thought I never hear from you again ( you left me) with tears in my eyes
When you told that you didn't want this anymore
Your action spoke louder than words
Your silence I heard
The only thing worse is hearing you now
Plant your seeds of doubt
When the love I found
Is on solid ground

CHORUS
Why is it (whooo)
Now that I'm in love
And found someone now you want me
The way you know I use to want you
But it's too late because we're through
Why is it
Someone else had to love me
For you see all that I could be
This love for me has new meaning
And when you find it you never ever let it go

VERSE 2
Now that things good
You telling me you could
Be understanding of the things you shoulda understood
Sorry but I'm not who you knew when you broke my heart into
Your action spoke louder than words
Your silence I heard
The only thing worse is hearing you now
Plant your seeds of doubt
When the love I found
Is on solid ground

CHORUS
Why is it (oh yeaah)
Now that I'm in love
And found someone now you want me
All i gave of me were things you asked me - but -wasn't enough
Don't want disappoint you but don't waste your time cuz
Love's got hold on my heart-body- soul - and mind
There's no need call me anymore
If you are looking for - the love we had don't live here any more

CHORUS
Why is it
Now that I'm in love
And found someone now you want me
The way you know I use to want you
But it's too late because we're through
Why is it
Someone else had to love me
For you see all that I could be
This love for me has new meaning
And when you find it you never ever let it go

Baby I'm yeah, said I'm good yeah
Hope you find somebody to love you like i did
Somebody who completes you ..yeah yeah",annotator_y,1,0,0,1,0,0,0,0,0,0
5714decd25ac0d8aee4024b3,See You Later Alligator,56d8236853a7ddfc01f93eb7,Dr. Feelgood,1987,1980,"(Guidry)

KEY: Emaj

When I saw my baby walkin',
With another man today,
When I saw my baby walkin'
With another man today.
When I asked her ""What's the matter?""
This is what I heard her say.

See you later alligator,
In a 'while, crocodile.
See you later alligator,
After a while, crocodile.
Can't you see you're in my way now?
Don't you know you cramp my style?

When I thought of what she told me,
Nearly made me lose my head.
When I thought of what she told me,
Nearly made me lose my head.
But the next time that I saw her,
Reminded her of what she said.

See you later alligator,
After a while, crocodile.
See you later alligator,
After a while, crocodile.
Can't you see you're in my way now?
Don't you know you cramp my style?

She said, ""I'm sorry, pretty daddy,
You know my love is just for you.""
She said, ""I'm sorry, pretty daddy,
You know my love is just for you,
Won't you say that you'll forgive me,
And say your love for me is true.""

I said, ""Wait a minute, 'gator,
I know you mean't it just for play.""
I said, ""Wait a minute, 'gator,
I know you mean't it just for play.
Don't you know you really hurt me,
And this is what I have to say. ""

See you later alligator,
After a while, crocodile.
See you later alligator,
After a while, crocodile.
Can't you see you're in my way now?
Don't you know you cramp my style?

See you later alligator,
After a while, crocodile.
See you later alligator,
After a while, crocodile.
Can't you see you're in my way now?
Don't you know you cramp my style?",annotator_y,1,0,0,0,0,0,0,0,0,0
5714dedd25ac0d8aee4c3c93,Jump,56d94d6bcc2ddd0c0f6b84a7,Nerina Pallot,2001,2000,"Oh good Lord above, I'm immune to the love of a good man
I go for the suckers, those mean motherfuckers I can't resist.
If I should get bitten. As long as he's smitten I understand
That pain comes with pleasure, such bittersweet treasure cannot be missed.

So how can you help me now?
I can't help myself....

I go on and jump, give it a try
Checking the parachute, see if it flies.
Oh I don't care if I should fall I never bruise....
I go on and just, give it a try
Don't call the ambulance, I'm still alive
And if I should break my neck I'll make the news.

The Friday night ritual of pulling habitual non-entities.
The lawyers, the bankers, the next morning thank you's and ""call you soon...""
These public school faces, I thought time erases one's misery
Oh no, it comes back to haunt you, old photos will taunt of your big mistake

So how can you save me now?
I can't save myself....

I go on and jump, give it a try
Checking the parachute, see if it flies.
I don't care if i should fall I never bruise....
I go on and jump, give it a try
Don't call the ambulance, I'm still alive
And if I should break my neck I'll make the news.

I go on and jump, give it a try
Checking the parachute, see if it flies.
Oh if I should break my neck I never bruise....
I go on and jump, give it a try
Don't call the ambulance, I'm still alive
And if I should break my neck I'll make the news.
I go on and jump, give it a try
Don't call the ambulance, I'm still alive
And if I should break my neck I'll make the news.",annotator_y,0,1,0,0,0,1,0,0,0,0
5714dee025ac0d8aee4e74c6,Bang On 'Em,56d95b9acc2ddd0c0f6b998d,Prodigy,2007,2000,"Here we go, you know what it is, click-clack

Bang on 'em, pop them thangs on 'em
Drop a nigga frontin', get 'em if I want 'em
I'ma bang on 'em, pop them thangs on 'em
Drop a nigga frontin', get 'em if I want 'em

I'ma bang on 'em, pop them thangs on 'em
Drop a nigga frontin', get 'em if I want 'em
I'ma bang on 'em, pop them thangs on 'em
Drop a nigga frontin', get 'em if I want 'em
I'ma bang

Ayo, my hood broke my heart into pieces
Dunn the streets took my dreams and shattered them
And turn me into a preacher
Minds to money got me not givin' a fuck

All I care about is muzik and who I gotta cut
With the Mac, uzi, .47, pick a weapon
Six million ways to die, my .25 endin'
When I pop him in the gut, I drop him where they stunt

I try keepin' it peace but that shit's for chumps
Projects fucked me up, made me strong as ox
Made the nigga cold blooded, ain't no friends on the block
This the comrades and coldies, the crooked ass police

Playin' cracks in the pocket send you up in creek
Look don't ask me why Queensbridge can't stick together
If you don't know the answer then you don't know the ghetto
Everybody don't get along and that's what it is
We either shootin' when we shoot them niggaz or we gon' get hit

Bang on 'em, pop them thangs on 'em
Drop a nigga frontin', get 'em if I want 'em
I'ma bang on 'em, pop them thangs on 'em
Drop a nigga frontin', get 'em if I want 'em

I'ma bang on 'em, pop them thangs on 'em
Drop a nigga frontin', get 'em if I want 'em
I'ma bang on 'em, pop them thangs on 'em
Drop a nigga frontin', get 'em if I want 'em
I'ma bang

Ayo, my own niggaz turned on me, B.I.G wasn't lyin'
When he said, the ones who smoke blunts with you be conversant
They was plottin' on my demise, they wanted my seed
At the head of the table but I'm permanently chief

I don't care how many bodies you got on your gun
You either submit or go and start your own gang son
Everybody wants to be boss, it ain't enough soldiers
Everybody wants to call shots, it ain't enough shooter

And it really hurts my soul that we can't click
But whatever it'll never be the same again
And when I see you niggaz, you already know what it is
And if you don't, you gon' find out the hard way kid
Tried to make it work, but now I'm on some other shit
I'm greedy with that limelight now you ain't gettin' none of it

Bang on 'em, pop them thangs on 'em
Drop a nigga frontin', get 'em if I want 'em
I'ma bang on 'em, pop them thangs on 'em
Drop a nigga frontin', get 'em if I want 'em

I'ma bang on 'em, pop them thangs on 'em
Drop a nigga frontin', get 'em if I want 'em
I'ma bang on 'em, pop them thangs on 'em
Drop a nigga frontin', get 'em if I want 'em
I'ma bang",annotator_y,0,1,0,0,0,0,0,1,0,0
5714decc25ac0d8aee3f5489,Leave In Silence,56d81e3853a7ddfc01f9371d,Depeche Mode,1982,1980,"I've told myself so many times before
But this time I think I mean it for sure
We have reached a full stop
Nothing's going to save us from the big drop

Reached our natural conclusion
Outlived the illusion
I hate being in these situations
That call for diplomatic relations

If I only knew the answer or I thought we had a chance or I could stop this
I would stop this thing from spreading like a cancer

What can I say
I don't want to play anymore
What can I say
I'm heading for the door
I can't stand this emotional violence
Leave in silence
Leave in silence

We've been running around in circles all year
Doing this and that and getting nowhere
This will be the last time
I think I said that last time

If I only had a potion, some magical lotion that could stop this
I would stop this, I would set the wheels in motion

What can I say
I don't want to play anymore
What can I say
I'm heading for the door
I can't stand this emotional violence
Leave in silence
Leave in silence

Leave in silence
Leave in silence",annotator_y,0,1,1,0,0,0,0,0,0,0
