song_id,song_title,artist_id,artist_name,song_year_combined,song_decade_combined,lyrics,Annotators,is_care,is_harm,is_fairness,is_cheating,is_loyalty,is_betrayal,is_authority,is_subversion,is_purity,is_degradation
5714dee725ac0d8aee5391e7,The Perfect Christmas,56d97c59cc2ddd0c0f6bcaba,The Cheetah Girls,2005,2000,"The breeze with snow and mistletoe
The presents under the tree
A GingerBread riding on a sled
It's the perfect christmas to me

The Candy Canes on Santa's lane
The stockings up on the wall
When sleigh bells ring and children sing
""Peace on earth and good will do all.""

It's the perfect holiday
Together with the family
It's the perfect christmas to me

It's Rudolph with his nose so bright
The songs we love to hear
All is come and all is right
It's the perfect time of the year

The decorations and celebrations
It's almost christmas day
The night before, anticapating
Santa on his way

It's the perfect holiday
Together with the family
It's the perfect christmas to me

And just like each and every year
I'll always make one wish
'Cause having all of you right here
Is the perfect christmas gift

The Candy Canes on Santa's lane
The stockings up on the wall
When sleigh bells ring and children sing
""Peace on earth and good will do all.""

It's the perfect holiday
Together with the family
It's the perfect christmas to me
(It's the perfect Christmas)

It's the perfect time for singing
The whole world in hormony
It's the perfect christmas to me
(Perfect to me-Yeah)

It's the perfect christmas to me",annotator_x,1,0,0,0,0,0,0,0,1,0
5714dec925ac0d8aee3ca657,Soul Collector,56d80c1753a7ddfc01f91d82,Cans,2004,2000,"I move across the earth
Dark shadows call my name
I am the chosen one, I am insane
I am your darkest fear
Your sinner and your saint
Through all eternity I set my sail

You cannot sleep at night
Still haunted, feel the fright
Your final revelation
Cold sweat, burning fear
You know the end is near
The ruler of the wastelands

Wielding the axe
Behold the bloodstains on the floor
Wielding the axe
I am the soul collector

Inside a raging storm
My spirit was reborn
Thy sins, the spark to feed my flames
You feel the cold winds blow
I'm breathing down your neck
Countdown, I'm ready to attack

Reflections from the blade
Your screams begin to fade
I will bring you salvation
Red hot, burning steel
The powers that I feel
The cure for my damnation

Wielding the axe
Behold the bloodstains on the floor
Wielding the axe
I am the soul collector",annotator_x,0,1,0,0,0,0,0,1,0,0
5714ded125ac0d8aee42d178,Candy Apple Red,56d834ce53a7ddfc01f9578a,George Hamilton IV,1964,1960,"He came speeding through the town each day at sundown
And his car was painted candy apple red
He was coming there to see the sheriff's daughter
And the sheriff didn't know it so they said
Time and time again the sheriff tried to catch him
But he always speeded up and got away
The old county jail stood patiently awaiting
And the sheriff vowed he'd put him there some day
Well there goes candy apple red that's what the people said
If he doesn't slow it down a bit he's gonna end up dead
And the sheriff's daughter said she'd rather end up dead
Than to live without her candy apple red

So the sheriff built a barricade to catch him
And he sat there at the limits of the town
But the sheriff's daughter had already met him
And had married him before the sun went down
When the sheriff saw the coming down the highway
He saw they couldn't stop and so he held his breath
As they crashed the barricade the car exploded
And the boy and girl went to a flaming death
Well there goes candy apple red that's what the people said
He didn't slow it down at all and he lies there dead
Now the sheriff bowed his head his daughter laied there dead
There in the arms of candy apple red",annotator_x,0,1,0,0,0,0,0,0,0,0
5714ded625ac0d8aee46a6c8,Mr. Wankerman,56d84d4553a7ddfc01f97aab,Joss Stone,2009,2000,"Mr., Mr., Mr., do you hear me?
Mr. Wankerman, I get so tired of your shit, yes, I do
Mr. Wankerman, you got no respect, no no
You're selfish, yes, you are, yes, you are, yes, you are

I've been checking my clock wouldn't it be worth a lot
If you would just call me, boy
We've been talking a lot, saying it'd be worth a shot
Saying that you want to fall

Wouldn't it be nice if you would turn up?
Maybe once or twice you'd pick the phone up
Shout it to my heart to know you won't be true
I keep hoping that I'll sober, maybe realize it's over
Will I ever see a change in you?

Mr. Wankerman, I get so tired of your shit
Mr. Wankerman, you got no respect, no
You're selfish yes, you are

Ain't got enough mistakes on my page for it all
You got me fucked, you got me fucked, baby
There was a time when I cried, now I don't care at all
Now I'm just bored, I'm so bored

See it's the same of something stupid
Had a falling out with Cupid
Told me fairy tales of someone with a heart

My prince charming took a wrong turn
When it sings and never came over
Will you smile and laugh when you're alone?
Will you smile, baby?

You're Mr. Wankerman, I get so tired of your shit
Yes, I do
Mr. Wankerman, you got no respect, no, no
You're selfish yes, you are

Mr. Wankerman, hey, hey, there
Mr., Mr., yeah, Mr. Wankerman, yeah, yeah

Mr. Wankerman, I get so tired of your shit
Mr. Wankerman, you got no respect, no
You're selfish, yes, you are, yes, you are, yes, you are

Mr. Wankerman, I'm gunna, I'm gunna let my band
Tell you something worth thinking about
Tell him for me, tell him for me now

Mr., Mr., Mr. Wankerman, yeah, yeah, yeah
Mr. Wankerman, I'm so tired, we all tired
Every single one of us here, we're sick and tired
We're sick and tired of your shit

Mr. Wankerman, I've been so tired of your shit
Along with everything else, baby
Mr. Wankerman, you got no respect for your lady
And you're selfish, yes, you are, yes, you are

Mr. Wankerman, yeah, yeah
Mr. Wankerman, yeah, yeah
Mr. Wankerman, you a wankerman
Yeah, yeah, yeah

I put up with your shit for such a long time
I'm not gunna take no more, no, no, no, no, no, no, no
I'm tired, baby, can't you see that I'm tired, love?
I even had to, I had to write song about it

It's ridiculous, yeah, to get you off my chest
Out of my head, out of my life for good, baby
'Cause you're just a silly little wankerman
Not worth it, silly little man, yeah

Moving on, moving on, moving on, moving on
To someone, taller, cuter, nicer and all the way better
And everything, everything I need, dear, yeah
You just so silly, baby, you're a wankerman

Thank you for dusty, love, she's really cute
And thank you for the lyrics, love, they really helped me out
Thank you for growing me up
I lost a lot of trust with you but I'm wiser for it, yes, I am

Now you can go on, boy
Don't turn around, just keep walking
Mr. Wankerman, yes, walking, walking, baby
You got a couple issues in your head
Nothing but a no-good, dirty ugly asshole
Maybe that was a little harsh
Walking, walking

Keep on bouncing, yeah, yeah
Keep on bouncing, step, step, stepping
Keep on stepping, keep on moving on
One foot in front of the other
Get the fuck out of my face, bitch
That's a keeper

Bitch, Mr. Wankerman
He's such a twat
Did anybody see 'War of the Worlds'?",annotator_x,0,0,0,0,0,1,0,1,0,0
5714dee025ac0d8aee4e6b00,Around The World In A Day,56d95b58cc2ddd0c0f6b994a,Prince,1985,1980,"Open your heart, open your mind
A train is leaving all day
A wonderful trip through our time
And laughter is all U pay
Around the world in a day, oh!
Around the world in a day

Now dig...
Loneliness already knows U
There ain't no reason 2 stay
Come here, take my hand, I'll show U
I think I know a better way, y'all

Around the world in a day, ow!
(Listen 2 me now)
Around the world in a day
All the babies sing it now

Ooh la, la
Ooh la, la, la, la
No, sha, sha
No, no shouting every day (No shouting every day)
No shouting (No shouting)
No, no shouting
Ha, ha, ha, ha, ha, ha, ha, ha
The little one will escort U
2 places within your mind
(The former is red, white, and blue)
Former is red, white, and blue!
(The latter is a purple climb)
The latter is a purple - come on and climb!

Around the world in a day, sugar (Oh, baby)
Around the world in a day
Come on, say it!
Around the world in a day
Say papa, I think I wanna dance!

(In summer she is sweeter)

Around the world in a day {repeat to fade}
Oh yeah!
All the little babies sing around the world
A government of love and music boundless in its unifying power
A nation of art 2 production
Sharing ideas, a shower of flowers",annotator_x,1,0,0,0,0,0,0,0,0,0
5714dec325ac0d8aee382309,Strong Arm Of The Law,56d7ead026a8a3040c6869d2,Aaron Watson,2001,2000,"His mother begged him to be a cattleman
But he chose to wear the star his daddy wore
God blessed him with a sharp eye and a quick hand
Quicker than the man who shot his daddy to the floor
Still she prayed and she pleaded
But ranch work lacked the vengeance he needed
He was cursed on his daddy's dying day
When a shot to the back laid him in six feet in a grave

Chorus

And he wears a star on his vest
The only thing between a bullet and the heart in his chest
He'll be a ranger till he takes his last draw
He was born with the strong arm of the law

He wore a colt 45 on his hip
One notch short on the ivory grip
Searching for the outlaw that broke his momma's heart
Riding through the badlands from daylight to dark

In a dirty back water border town
Where the outlaw thought he could not be found
He looked like he'd seen a ghost when he saw the ranger's face
A legacy to the lawman he sent to his resting-place

Chorus

The outlaw had no place to run
So he turned to the trigger on his gun
As the smoke cleared blood stained the dusty street
The outlaw lay dying at the ranger's feet

He sat in the saddle and shook his head
His gun still hot and his father still dead
As the sun set on the day he'd waited so long for
He saw justice belongs to the law but vengeance is the lord's",annotator_x,0,0,0,0,1,0,1,0,0,0
5714dedf25ac0d8aee4d7e99,Convoy,56d9559dcc2ddd0c0f6b916a,Paul Brandt,2004,2000,"(Yeah, breaker one-nine, this here's the Rubber Duck, you got a copy
on me Pigpen? C'mon.)
(Ah yeah, ten-four Pigpen, for sure, for sure. By golly it's clean clear to
Flagtown. C'mon.)
(Yeah, that's a big ten-four there Pigpen. Yeah, we definitely got the
front door good buddy. Mercy sakes alive, looks like we got us a
convoy)

It was the dark of the moon on the sixth of June
In a Kenworth pullin logs
Cab over Pete with a reefer on
And a Jimmy haulin hogs
We's headed for bear on eye-one-oh
About a mile outta Shakeytown
I says 'Pigpen, this here's the Rubber Duck
And I'm about to put the hammer down'

Coz we got a little ol' convoy rockin' thru the night
Yeah we got a little ol' convoy aint she a beautiful sight
Come on and join our convoy aint nothin' gonna get in our way
We gonna roll this fuckin' convoy 'cross the USA
Convoy

(Ah, breaker, Pigpen this here's the Duck an' you wanna back off on
them hogs?)
(Ah, ten-four, about five mile or so)
(Ten roger, them hogs is gettin' IN-tense up here)

By the time we got into Tulsa town we had 85 trucks in all
But they's a roadblock up on the cloverleaf
And them bears 's wall to wall
Yeah them smokeys 's thick as bugs on a bumper
They even had a bear in the air
I says 'Callin' all trucks, this here's the Duck
We about to go a-huntin' bear'

Coz we got a great big convoy rockin' thru the night
Yeah we got a great big convoy aint she a beautiful sight
Come on and join our convoy aint nothin' gonna get in our way
We gonna roll this fuckin' convoy 'cross the USA
Convoy

(Ah, you want to give me a ten-nine on that Pigpen?)
(Ah, negatory Pigpen, you're still too close. Yeah them hogs is startin'
to close up my sinuses. Mercy's sakes you better back off another ten)

Well we rolled up Interstate Forty-Four
Like a rocket sled on rails
We tore up all of our swindle sheets
And left 'em sittin' on the scales
By the time we hit that Shi town
Them bears was a-gettin' smart
They bought up some reinforcements
From the Illinois National Guard

There's armoured cars and tanks and jeeps
An' rigs of ev'ry size
Yeah them chicken coops was full of bears
And choppers filled the skies
Well we shot the line
We went for broke
With a thousand screaming trucks
And eleven longhaired friends of Jesus
In a chartreuse microbus

(Ah, Rubber Duck, this 's Sodbuster. C'mon here?)
(Yeah, ten-four Sodbuster. Listen, ya wanna put that microbus in
behind that suicide jockey?)
(Yeah he's haulin' dynamite and he needs all the help he can get)

Well we laid a strip for the Jersey shore
Prepared to cross the line
I could see the bridge was lined with bears
But I didn't have a doggone dime
I says 'Pigpen this here's the Rubber Duck
We just aint gonna pay no toll'
So we crashed the gate doin' ninety-eight
I says 'Let them truckers roll, ten-four'

Coz we got a mighty convoy rockin' thru the night
Yeah we got a mighty convoy aint she a beautiful sight
Come on and join our convoy aint nothin' gonna get in our way
We gonna roll this fuckin' convoy 'cross the USA
Convoy

(Ah, ten-four Pigpen. What's your twenty? OMAHA? Well they oughta
know what to do with them hogs out there, for sure. Well mercy sakes
good buddy, we gonna back on outta here, so keep your thumbs off
your glass and the bears off your ......tail. We'll catch you on the
flip-flop. This here's the Rubber Duck on the side. We gone. 'bye 'bye.)",annotator_x,0,0,0,0,0,0,0,1,0,0
5714dee325ac0d8aee50a32e,Say Ho,56d9693ccc2ddd0c0f6badb0,Scott Miller,2006,2000,"He was born in Virginia
In the Shenadoah Valley
Right about the time that this country got free
When his father died they left
Packed it up and headed west
To the hills that put the east in Tennessee
Say Ho
A man has got to make his mark
And the second british war did start
He was bored so he joined and went along
Took an arrow in the hip
A ball in the shoulder but he ever quit
Still full of fight when they finally dragged him home
Say ho
Reading Homer to some Cherokee maidens
And you know how TN is in the fall
If you're not gonna make your dreams epic
Why bother to dream anything at all?
He met a man named Andy Jack
Who put him on the nashville map
But even then that town could piss you off
Partied hard and ran the state
Found a girl to take his name
And they still don't know why he up and left it all
Say Ho
Never trust nobody when you're drinking
Lest you get insulted or rolled
Drink too much you'll pickle up your instinct
And then you cant trust anyone at all
Half mystic and half showman
Half poet and half sage
And way too stubborn to ever admit defeat
Although Texas was no state
San Jacinto was the place
That destiny was ready to be seized
Say Ho
Well Texas he created you
And three times he did save you too
And tried to help you make it on your own
You joined the union anyway
And when he thought you should stay
You turned your back on him and sent him home
SayHo
Is there anyone still left so full of honor
That you trust everything you heard?
In Texas anywhere that you may wander
Sam Houston was the man that kept his word",annotator_x,0,0,0,0,1,0,0,0,0,0
5714ded125ac0d8aee42ead4,Man Worth Lovin' You,56d8355153a7ddfc01f9583f,George Jones,2008,2000,"If I hadn't quit my ways of wrong I know what I would have done
I kept falling down in life till I became no one
But you found me just in time and held my head up high
And showed me the right way I should go and made me realize
I hadn't reached the end of life your love have pulled me through
Then you made me become the man worth lovin' you.

Yes, you gave me a reason to keep livin'
And made me have some faith in what I do
Yes, you gave me a reason to start givin'
When I became the man worth lovin' you.

I thought that life have turned on me and made me lose my faith
But I know now it wasn't life that filled my heart with pain
I thought that love have turned me down until you came along
But now I know what real love is I feel it to the bone
I hadn't reached the end of life your love have pulled me through
When you made me became the man worth lovin' you.

Yes you gave me a reason to keep livin'
And made me have some faith in what I do
Yes, you gave me a reason to start givin'
When I became the man worth lovin' you.

When I became the man worth lovin' you",annotator_x,1,0,0,0,0,0,0,0,0,0
5714dec925ac0d8aee3cbb34,Special Lady,56d80ca353a7ddfc01f91e55,Carl Thomas,2000,2000,"Baby, for every time that you felt love was taken for granted
And I didn't care
Well, these are just a few words
To let you know how I feel
Hey, yeah
(Let me be the first to let you know)

Oh, I had an awful dream
That you were needing someone else's love to take the place of mine
So I over came the distance
That challenged my persistence
I let my ego go and drowned my pride
And you ask why

You're such a special lady
Though I haven't told you lately
So let me be the first to let you know
Such a special lady
Though I haven't told you lately
So let me be the first to let you know

One more thing I need to say
Is that I need you every day
It's not the same 'till you come back to me
Girl I've loved you from conception
So if you follow my direction
I'll lead you where you always need to be
Right next to me, oh

You're such a special lady
Though I haven't told you lately
So let me be the first to let you know
Such a special lady
Though I haven't told you lately
So let me be the first to let you know

Let me be the first to let you know
I appreciate the things you do for me
When you're loving me at night
Let me be the first to let it show
I'd show the way to go
Cuz every waking move is oh so right

You're such a special lady
Though I haven't told you lately
So let me be the first to let you know
Such a special lady
Though I haven't told you lately
So let me be the first to let you know",annotator_x,1,0,0,0,0,0,0,0,0,0
5714deeb25ac0d8aee564daf,Fly Away,56d98d69cc2ddd0c0f6be2b0,Tyrese,2006,2000,"Posse's just rollin and my phone just rang, it's the homie and he ain't sure
bout a
Couple things. My nigga, you busy? Naw. Got a minute? wassup? I'm goin through
some
Deep shit. Hit me with it. I think this rap shit is takin it's toll. I shoulda
left
This shit alone a long time ago. No see what happened is you changed the game,
if you
Wasn't nice with it they wouldn't be speaking your name. My nigga you really
think I
Can make it as a rapper? Hell yeah cause most of these rap niggas is actors.
Yeah but
In they mind I'm a always be a r&b nigga. Fuck that real niggas know real
niggas.
So what's next? We keep coming with these hits. No guts no glory man we share
the
Same story. Nah you never came from signing to rappin. Yeah but I went from
rappin
To actin. Harrison Ford? I ain't really like that movie. Ty, we talkin about
me or
You bein a emcee? My bad, my nigga, so what should I do?
Just keep it real homey and stay true to you, listen.

[Chorus:]
Don't pay attention to the haters, don't let em stand in your way
Cause niggas in the hood on the block always got some bullshit to say
Don't pay attention to the haters, don't let em stand in your way
With God all things are possible, it's your time to shine so fly away

Jody Jod you still there? Aw nigga you trippin. All right listen I'm tryin to
Understand this business. What's up? I'm tryin to be in this executive game,
I'm

Trying to wear many hats like an executive man. My nigga it ain't nothing you
done
Been there and done that and ran rap and back you can get that. But where's
the
Channels? Nobody's openin doors. You experienced this before my nigga tell me
some
More. Just pay attention, there's a lot of rappers in presidential positions.
I'm
Wishing that I can get in that position. I got you, fo sure, my nigga don't
trip
Ty, I'm also trying to get full on into this actin shit. Man I got you, I got
a
Lot of flicks coming up, just come through I'll hook you up. You think they'll
Fuck with Kurupt? For sho. All right this is what I'm gonna do, after I get
out
The studio with Snoop I'll come through. I'm ready to get it crackin, I'm
ready
To take flight. My nigga, we both gonna be all right.

[Chorus]

Fly far away, don't never look back. If they could do what you could do, they
would love to do it. So that's why they got an opinion, but to me you see
opinions is like a asshole,
Everybody got one. That don't mean I'm gonna stop doin what I do cause you
can't do it.

[Chorus: til Fade]",annotator_x,0,0,1,0,0,0,0,0,0,0
5714ded025ac0d8aee421eea,Dolla,56d8303e53a7ddfc01f95143,Fort Minor,2005,2000,"(feat. Styles Of Beyond)

(Mike:)
Yeah, like that Y'all
Uh huh, whoo, like that
Fort Minor, S.O.B.
Yeah, like this, listen

Attention please, I only need a second
To make a mental impression directly on any record so
Give me space to move, room to prove I'm stupid with the P's and Q's
Ladies and gentlemen I'm sending you bending
Pretending the pen is a needle, I'm injecting the venom
And I'll be damned if I let another man get to me
I'll bruise you with a shoe to the family jewelry
I'm back with fury, attack quickly
Sick with a BIC pen, all up in your shit man
You never knew the flow was sick as this
Bitch, listen when I'm letting you know
Got a grip on these tracks that you wish you got
Got a clique full of assholes, I kid you not
So when that mixtape's done and that album drops
Ryu and Tak and me got it loaded and locked, believe it

(Ryu:)
You still breathing? I'm cocking and squeezing
Tucked still? Nope, I don't give a fuck who sees it
Broad days sitting sideways, stuffed in a small cave
For three fucking weeks 'til you reek like dog waste
Ugh, really, I put a punk in his place
Let's see if he freestyles with a pump in his face
Got something to say? Please, better keep it a secret
The streets got hideous ways of handling beef, bitch
So eat shit, hate it or love it, the underdogs on top
Getting faded telling people to suck it
Bucking 'em down for real while you fucking around
I'm stuck in the house for months tryin to sharpen my skills
So how does it feel? You lames want to claim my throne
You got a better chance getting Danny Hayes on the phone
Good luck, I flame suckers 'til they're black and crispy
Sneaking heat up in the club like a flask of whisky

(Tak:)
Yeah, I'm here to crack the roof in
You got a nice watch but your raps are useless
You better cut the crap 'fore i snap some nooses
And leave you all snoozing' on some afternoon shit
I hit the streets with a cake and batter for fun
Just to spit bleach in his face
It's lunchtime punk, open the face
Hit you with a punchline 'til you choke on your teeth
Catch me at the show rockin' in that tipsy mode
Like Angels and Demons unlocking DaVinci's Code
One drop in the cannister, people split the globe
Blowing every planet to shit once I hit the road
You in the tight bitch, cut you with apathy
I'm on the night shift see I hustle like cassidy
So kick that shit sound and let the west coast see
One of the illest names, Ribkat from S.O.B.

(Green Lantern:)
That's right, Fort Minor
We Major, Mike Shinoda, S.O.B.
Heavy Guard, Machine Shop, Linkin Park
You know, man, this is an...",annotator_x,0,1,0,0,0,0,0,0,0,1
5714dedd25ac0d8aee4c0b6c,Energy,56d94c26cc2ddd0c0f6b82ef,Natalie,2005,2000,"(Baby Bash)
Energy, digging on your energy
Energy, digging on your energy
Energy, digging on your energy. energy

(Chorus 2x)
Boy, I'm digging on your energy (Energy)
And I'm digging what you telling me (Telling me)
So I wrote this little melody (Melody)
And dedicate it to my favorite lover

(Verse 1 - Natalie)
I'm lying in bed
There's thoughts in my head
I'm thinking bout you
Over and over and over and over again
What can I tell you, you got me so twisted
Tossing and turning
Over and over and over and over again
So I wrote a song tonight (Tonight)
You weren't begging me to write (To write)
Tell me is it cool tonight (Tonight)
To let you know what's on my mind

(Chorus 2x)
Boy, I'm digging on your energy (Energy)
And I'm digging what you telling me (Telling me)
So I wrote this little melody (Melody)
And dedicate it to my favorite lover

(Verse 2 - Baby Bash)
Rain and shine sleet and snow
Couldn't stop the way we flow
Welcome to my miracle
And I'm digging on your lyrical
Your melody is my remedy
Squeeze to my Hennessey
The one to call when I'm sipping for
With the candy coated Tennessee
Just make a wish.
And let's make it official with your boy Baby Bash with some heavenly bliss
Because your kisses on my lips, girl I'm ready to roll
With so vicious and bubblicious, the energy's throwed

(Chorus 2x)
Boy, I'm digging on your energy (Energy)
And I'm digging what you telling me (Telling me)
So I wrote this little melody (Melody)
And dedicate it to my favorite lover

(Verse 3 - Natalie)
Boy, you know that I dig you
I fell in love when I met you
I love the way you make me feel
Your energy is something real (Fa. sho.)
Boy, I love the way (I love the way)
You make me feel (You make feel)
Is something bout you loving me
Can't do without your energy

(Chorus 2x)
Boy, I'm digging on your energy (Energy)
And I'm digging what you telling me (Telling me)
So I wrote this little melody (Melody)
And dedicate it to my favorite lover

(Baby Bash)
Energy, digging on your energy
Energy, digging on your energy
Energy, digging on your energy. energy",annotator_x,1,0,0,0,0,0,0,0,0,0
